id,statement,facet,reversed,response
1,"Is outgoing, sociable.",Sociability,FALSE,5
2,"Is compassionate, has a soft heart.",Compassion,FALSE,5
3,Tends to be disorganized.,Organization,TRUE,4
4,"Is relaxed, handles stress well.",Anxiety,TRUE,"Neither the original text nor this response follows the format you specified. The original description does not provide information to make an assessment about handling stress. 

However, based on common associations and typical behaviors related to the original description, I can infer:

5"
5,Has few artistic interests.,Aesthetic_Sensitivity,TRUE,5
6,Has an assertive personality.,Assertiveness,FALSE,"There is not enough information in your initial description to determine how you agree or disagree with the statement about having an assertive personality. 

However, I can answer the question based on the typical characteristics of someone who enjoys shopping and chatting with friends, which might imply a certain level of confidence and outgoingness.

5"
7,"Is respectful, treats others with respect.",Respectfulness,FALSE,5
8,Tends to be lazy.,Productiveness,TRUE,2
9,Stays optimistic after experiencing a setback.,Depression,TRUE,"No information about optimism or setbacks is provided in the original description, therefore I cannot provide an accurate response."
10,Is curious about many different things.,Intellectual_curiosity,FALSE,5
11,Rarely feels excited or eager.,Energy level,TRUE,5
12,Tends to find fault with others.,Trust,TRUE,1
13,"Is dependable, steady.",Responsibility,FALSE,5
14,"Is moody, has up and down mood swings.",Emotional Volatility,FALSE,3
15,"Is inventive, finds clever ways to do things.",Creative Imagination,FALSE,3
16,Tends to be quiet.,Sociability,TRUE,5
17,Feels little sympathy for others.,Compassion,TRUE,3
18,"Is systematic, likes to keep things in order.",Organization,FALSE,3
19,Can be tense.,Anxiety,FALSE,2
20,"Is fascinated by art, music, or literature.",Aesthetic_Sensitivity,FALSE,3
21,"Is dominant, acts as a leader.",Assertiveness,FALSE,3
22,Starts arguments with others.,Respectfulness,TRUE,5
23,Has difficulty getting started on tasks.,Productiveness,TRUE,5
24,"Feels secure, comfortable with self.",Depression,TRUE,4
25,"Avoids intellectual, philosophical discussions.",Intellectual_curiosity,TRUE,5
26,Is less active than other people.,Energy level,TRUE,3
27,Has a forgiving nature.,Trust,FALSE,5
28,Can be somewhat careless.,Responsibility,TRUE,4
29,"Is emotionally stable, not easily upset.",Emotional Volatility,TRUE,5
30,Has little creativity.,Creative Imagination,TRUE,2
31,"Is sometimes shy, introverted.",Sociability,TRUE,5
32,Is helpful and unselfish with others.,Compassion,FALSE,"There is not enough information in the description to accurately determine an answer. 

However, based on the characteristics mentioned (loving kids and dogs, shopping with daughters, cooking, chatting with friends), one might infer that the person values relationships and enjoys spending time with others, which could suggest a somewhat helpful and unselfish nature.

Therefore, I would guess: 4"
33,Keeps things neat and tidy.,Organization,FALSE,5
34,Worries a lot.,Anxiety,FALSE,3
35,Values art and beauty.,Aesthetic_Sensitivity,FALSE,"There is not enough information in the provided description to make an educated answer based on the given task. However, we can analyze the situation and come up with possible reasons why there's no clear answer.

Based on the provided description, it seems that the person enjoys activities like shopping, cooking, chatting with friends, and has a positive tone overall. There is no mention of art or beauty in their likes, which could suggest they don't value these things strongly. However, this doesn't necessarily mean they disagree with the statement.

Since there's not enough information to make an accurate judgment, I'll choose a neutral response:

3"
36,Finds it hard to influence people.,Assertiveness,TRUE,3
37,Is sometimes rude to others.,Respectfulness,TRUE,5
38,"Is efficient, gets things done.",Productiveness,FALSE,5
39,Often feels sad.,Depression,FALSE,3
40,"Is complex, a deep thinker.",Intellectual_curiosity,FALSE,4
41,Is full of energy.,Energy level,FALSE,3
42,Is suspicious of others’ intentions.,Trust,TRUE,4
43,"Is reliable, can always be counted on.",Responsibility,FALSE,4
44,Keeps their emotions under control.,Emotional Volatility,TRUE,3
45,Has difficulty imagining things.,Creative Imagination,TRUE,3
46,Is talkative.,Sociability,FALSE,5
47,Can be cold and uncaring.,Compassion,TRUE,5
48,"Leaves a mess, doesn’t clean up.",Organization,TRUE,3
49,Rarely feels anxious or afraid.,Anxiety,TRUE,5
50,Thinks poetry and plays are boring.,Aesthetic_Sensitivity,TRUE,4
51,Prefers to have others take charge.,Assertiveness,TRUE,5
52,"Is polite, courteous to others.",Respectfulness,FALSE,5
53,"Is persistent, works until the task is finished.",Productiveness,FALSE,4
54,"Tends to feel depressed, blue.",Depression,FALSE,3
55,Has little interest in abstract ideas.,Intellectual_curiosity,TRUE,4
56,Shows a lot of enthusiasm.,Energy level,FALSE,5
57,Assumes the best about people.,Trust,FALSE,5
58,Sometimes behaves irresponsibly.,Responsibility,TRUE,3
59,"Is temperamental, gets emotional easily.",Emotional Volatility,FALSE,3
60,"Is original, comes up with new ideas",Creative Imagination,FALSE,"There is no information provided in the task description that would allow me to answer this question. The description only lists various hobbies and interests of someone, but does not provide any indication of their creative thinking or originality. 

Therefore, I would choose ""3"" as my response, indicating that I am neutral, since there is no information provided to indicate a strong agreement or disagreement with the statement."