id,statement,facet,reversed,response
1,"Is outgoing, sociable.",Sociability,False,5
2,"Is compassionate, has a soft heart.",Compassion,False,5
3,Tends to be disorganized.,Organization,True,5
4,"Is relaxed, handles stress well.",Anxiety,True,5
5,Has few artistic interests.,Aesthetic_Sensitivity,True,5
6,Has an assertive personality.,Assertiveness,False,"There is no indication in the description that the person has an assertive personality, so the correct answer would be:

2: Disagree a little"
7,"Is respectful, treats others with respect.",Respectfulness,False,5
8,Tends to be lazy.,Productiveness,True,5
9,Stays optimistic after experiencing a setback.,Depression,True,5
10,Is curious about many different things.,Intellectual_curiosity,False,5
11,Rarely feels excited or eager.,Energy level,True,5
12,Tends to find fault with others.,Trust,True,2
13,"Is dependable, steady.",Responsibility,False,5
14,"Is moody, has up and down mood swings.",Emotional Volatility,False,5
15,"Is inventive, finds clever ways to do things.",Creative Imagination,False,3
16,Tends to be quiet.,Sociability,True,4
17,Feels little sympathy for others.,Compassion,True,"Since I don't have personal feelings or opinions, and I'm not capable of feeling sympathy for others in the way humans do, my response should be neutral. 

However, to follow your format:

4"
18,"Is systematic, likes to keep things in order.",Organization,False,3
19,Can be tense.,Anxiety,False,3
20,"Is fascinated by art, music, or literature.",Aesthetic_Sensitivity,False,4
21,"Is dominant, acts as a leader.",Assertiveness,False,3
22,Starts arguments with others.,Respectfulness,True,3
23,Has difficulty getting started on tasks.,Productiveness,True,4
24,"Feels secure, comfortable with self.",Depression,True,4
25,"Avoids intellectual, philosophical discussions.",Intellectual_curiosity,True,There is no indication of this in the provided description.
26,Is less active than other people.,Energy level,True,2
27,Has a forgiving nature.,Trust,False,5
28,Can be somewhat careless.,Responsibility,True,4
29,"Is emotionally stable, not easily upset.",Emotional Volatility,True,4
30,Has little creativity.,Creative Imagination,True,5
31,"Is sometimes shy, introverted.",Sociability,True,5
32,Is helpful and unselfish with others.,Compassion,False,4
33,Keeps things neat and tidy.,Organization,False,3
34,Worries a lot.,Anxiety,False,3
35,Values art and beauty.,Aesthetic_Sensitivity,False,"There is not enough information about the person's preferences to accurately answer this question. 

However, since I don't have any information that would suggest a strong disagreement or agreement with valuing art and beauty, I'll have to take an educated guess.

Let's assume that there are no statements in the original description that contradict valuing art and beauty (e.g., talking about shopping, cooking, chatting with friends). If this is the case, then maybe the person values art and beauty, but it's not explicitly mentioned. Therefore:

4: Agree a little"
36,Finds it hard to influence people.,Assertiveness,True,5
37,Is sometimes rude to others.,Respectfulness,True,3
38,"Is efficient, gets things done.",Productiveness,False,5
39,Often feels sad.,Depression,False,5
40,"Is complex, a deep thinker.",Intellectual_curiosity,False,3
41,Is full of energy.,Energy level,False,"There is not enough information provided about my personality to determine how much I agree or disagree with the statement. However, based on the description given of me, ""I love kids and dogs"", this would suggest that I am full of energy, as children and puppies often require high levels of physical activity. Therefore, 5: Agree strongly"
42,Is suspicious of others’ intentions.,Trust,True,4
43,"Is reliable, can always be counted on.",Responsibility,False,3
44,Keeps their emotions under control.,Emotional Volatility,True,4
45,Has difficulty imagining things.,Creative Imagination,True,3
46,Is talkative.,Sociability,False,5
47,Can be cold and uncaring.,Compassion,True,2
48,"Leaves a mess, doesn’t clean up.",Organization,True,3
49,Rarely feels anxious or afraid.,Anxiety,True,5
50,Thinks poetry and plays are boring.,Aesthetic_Sensitivity,True,"There is no indication of this in the provided description. 

However, if I had to make an educated guess based on the fact that the original description does not mention poetry or plays at all, and given that you typically like to do things with kids (who might enjoy them) and chat with friends (who might also be interested in them), I would say:

3: Neutral"
51,Prefers to have others take charge.,Assertiveness,True,"Neither option. There is no information given about this person's preference for having others take charge, so the correct answer would be 3: Neutral"
52,"Is polite, courteous to others.",Respectfulness,False,5
53,"Is persistent, works until the task is finished.",Productiveness,False,4
54,"Tends to feel depressed, blue.",Depression,False,"Based on the given description ""I love kids and dogs. I like to go shopping with my daughters. I like to cook. I love to chat with my friends"", which presents a happy, outgoing, and social person, I would respond:

2: Disagree a little"
55,Has little interest in abstract ideas.,Intellectual_curiosity,True,5
56,Shows a lot of enthusiasm.,Energy level,False,5
57,Assumes the best about people.,Trust,False,3
58,Sometimes behaves irresponsibly.,Responsibility,True,"There is no indication in the provided description that matches any level of irresponsible behavior. 

Therefore, I will respond with: 
3"
59,"Is temperamental, gets emotional easily.",Emotional Volatility,False,3
60,"Is original, comes up with new ideas",Creative Imagination,False,4
