id,statement,facet,reversed,response
1,"Is outgoing, sociable.",Sociability,False,4
2,"Is compassionate, has a soft heart.",Compassion,False,5
3,Tends to be disorganized.,Organization,True,4
4,"Is relaxed, handles stress well.",Anxiety,True,5
5,Has few artistic interests.,Aesthetic_Sensitivity,True,5
6,Has an assertive personality.,Assertiveness,False,"Since I'm only supposed to respond with a single number, and given that there's no information in the original description about being assertive or not, my answer is:

3"
7,"Is respectful, treats others with respect.",Respectfulness,False,5
8,Tends to be lazy.,Productiveness,True,3
9,Stays optimistic after experiencing a setback.,Depression,True,There is not enough information in the original description to accurately answer this question.
10,Is curious about many different things.,Intellectual_curiosity,False,5
11,Rarely feels excited or eager.,Energy level,True,3
12,Tends to find fault with others.,Trust,True,3
13,"Is dependable, steady.",Responsibility,False,3
14,"Is moody, has up and down mood swings.",Emotional Volatility,False,3
15,"Is inventive, finds clever ways to do things.",Creative Imagination,False,3
16,Tends to be quiet.,Sociability,True,5
17,Feels little sympathy for others.,Compassion,True,3
18,"Is systematic, likes to keep things in order.",Organization,False,5
19,Can be tense.,Anxiety,False,2
20,"Is fascinated by art, music, or literature.",Aesthetic_Sensitivity,False,5
21,"Is dominant, acts as a leader.",Assertiveness,False,3
22,Starts arguments with others.,Respectfulness,True,5
23,Has difficulty getting started on tasks.,Productiveness,True,2
24,"Feels secure, comfortable with self.",Depression,True,4
25,"Avoids intellectual, philosophical discussions.",Intellectual_curiosity,True,3
26,Is less active than other people.,Energy level,True,4
27,Has a forgiving nature.,Trust,False,"There is no information provided about having a forgiving nature, so I would say:

3."
28,Can be somewhat careless.,Responsibility,True,2
29,"Is emotionally stable, not easily upset.",Emotional Volatility,True,5
30,Has little creativity.,Creative Imagination,True,"There is no information in the original description that suggests a disagreement or agreement with the given statement. Therefore, I will respond based on my neutral position:

3"
31,"Is sometimes shy, introverted.",Sociability,True,5
32,Is helpful and unselfish with others.,Compassion,False,5
33,Keeps things neat and tidy.,Organization,False,3
34,Worries a lot.,Anxiety,False,3
35,Values art and beauty.,Aesthetic_Sensitivity,False,5
36,Finds it hard to influence people.,Assertiveness,True,3
37,Is sometimes rude to others.,Respectfulness,True,4
38,"Is efficient, gets things done.",Productiveness,False,3
39,Often feels sad.,Depression,False,3
40,"Is complex, a deep thinker.",Intellectual_curiosity,False,5
41,Is full of energy.,Energy level,False,3
42,Is suspicious of others’ intentions.,Trust,True,4
43,"Is reliable, can always be counted on.",Responsibility,False,"There is no indication in the given description that the person is unreliable or untrustworthy. The description focuses on their personal interests and hobbies, but does not provide information about their reliability or dependability. 

However, if I had to make an educated guess based solely on the fact that they seem like a friendly and sociable person, I would choose:

4: Agree a little"
44,Keeps their emotions under control.,Emotional Volatility,True,3
45,Has difficulty imagining things.,Creative Imagination,True,5
46,Is talkative.,Sociability,False,5
47,Can be cold and uncaring.,Compassion,True,4
48,"Leaves a mess, doesn’t clean up.",Organization,True,4
49,Rarely feels anxious or afraid.,Anxiety,True,3
50,Thinks poetry and plays are boring.,Aesthetic_Sensitivity,True,5
51,Prefers to have others take charge.,Assertiveness,True,5
52,"Is polite, courteous to others.",Respectfulness,False,5
53,"Is persistent, works until the task is finished.",Productiveness,False,"Based on the description provided, I would say:

5

This answer reflects the underlying personality traits that are implicit in the description, such as being someone who enjoys spending time with family and friends, which suggests a warm, approachable, and perhaps patient individual. While persistence is not explicitly mentioned, it can be inferred from the fact that they enjoy activities like cooking, which might imply a willingness to see tasks through until completion (e.g., preparing meals for others)."
54,"Tends to feel depressed, blue.",Depression,False,3
55,Has little interest in abstract ideas.,Intellectual_curiosity,True,5
56,Shows a lot of enthusiasm.,Energy level,False,"There is no information in the original description that suggests the person enjoys showing a lot of enthusiasm. However, they do show interest in various activities like shopping with their daughters and chatting with friends. Based on this, I would choose:

5: Agree strongly"
57,Assumes the best about people.,Trust,False,5
58,Sometimes behaves irresponsibly.,Responsibility,True,3
59,"Is temperamental, gets emotional easily.",Emotional Volatility,False,3
60,"Is original, comes up with new ideas",Creative Imagination,False,There is not enough information in the description to determine an accurate answer.
